{"counts":{"contained_record_count":0,"record_count":1,"top_level_record_count":1},"edges":[{"edge_key":"d9262742748ae23661cc9000640c5631b53a4d8dd6baf39e3449f473791bfc25","expected_target":{"content_sha256":"4194a039834f98ad26f7be9126321882869ba9edb47fe706577f98b4f91a77ab","identity_type":"revision_id","identity_value":"e5c0025767d38c01ada4b49db42eeda0f1544208ac8107741fd9b1e24aa807e5","kind":"REFINEMENT","manifest_sha256":"bb75b56d06841902a4700814e87ea045bb9a24e62c56ba041b3b7958f089a625","record_schema_version":"tcw.refinement-manifest/v0.5","run_id":"missing-refinement-run"},"from_record_key":"516caaa1c5d49465ca675683dd4ff3c244e9a2267d8472a6514ab9e9532b7743","relation":"CORPUS_EXTERNAL_REFINEMENT","state":"MISSING","target_record_key":null}],"projection_role":"DERIVED_READ_ONLY","records":[{"admission_origin":"TOP_LEVEL","artifact_count":3,"artifact_integrity":"VERIFIED","contained_by":[],"identity":{"corpus_id":"quality-corpus","snapshot_id":"4bfd8b53e7f14cbd575165ced1c8b8e32c1b0f193efd95fc8536156b0b05674e"},"kind":"CORPUS","manifest":{"artifact_key":"bb86b2096523acd662832aec52811f6b97eef019e566e7db642cd95e025c99a0","availability":"AVAILABLE","origin":"ROOT_MANIFEST","record_key":"516caaa1c5d49465ca675683dd4ff3c244e9a2267d8472a6514ab9e9532b7743","recorded_media_type":"application/json","relative_path":"corpus-manifest.json","role":"corpus-manifest","served_media_type":"text/plain; charset=utf-8","sha256":"95442cabfd74a7abf5c12ae3be7401c28474045019a3901b0b64992dde0abb57","size":6144},"record_key":"516caaa1c5d49465ca675683dd4ff3c244e9a2267d8472a6514ab9e9532b7743","record_schema_version":"tcw.corpus-manifest/v0.5","run_id":"corpus-run-quality-matrix","status":"PARTIAL"}],"runtime":{"package_version":"0.5.0","provenance_id":"a5a630105bd473d947a5dc988b6b75e30dbf0cca5b666a014e9a002d9bcb9f93"},"schema_version":"tcw.workbench-projection/v0.5","session_id":"c22f7f7ed08955821e2b16f78ea7abc3759f625c9f96fbed84a0d1b9b5b74b26"}
