{"counts":{"contained_record_count":0,"record_count":1,"top_level_record_count":1},"edges":[],"projection_role":"DERIVED_READ_ONLY","records":[{"admission_origin":"TOP_LEVEL","artifact_count":5,"artifact_integrity":"VERIFIED","contained_by":[],"identity":{"observation_id":"eb0f36ea65a76a6b8758cd5638ab56ff0b9d680ecbd7e01d6dcd61d08ab1500e"},"kind":"OBSERVATION","manifest":{"artifact_key":"3dbb71923f1c9e146dfd862dfe7e0187731dae1145726a0e58e4e3d5fb35bb2a","availability":"AVAILABLE","origin":"ROOT_MANIFEST","record_key":"23e14d54a7a9eff5756691bc93da69843aaf2ada4dd75a2f877ae456d8af3285","recorded_media_type":"application/json","relative_path":"manifest.json","role":"preparation-manifest","served_media_type":"text/plain; charset=utf-8","sha256":"b37fe6461084d4c35ffef642536371b1d2724a1e4156c4201dd8b04b27e64740","size":4096},"record_key":"23e14d54a7a9eff5756691bc93da69843aaf2ada4dd75a2f877ae456d8af3285","record_schema_version":"tcw.preparation-manifest/v0.5","run_id":"observation-run-policy-memo","status":"SUCCESS"}],"runtime":{"package_version":"0.5.0","provenance_id":"a5a630105bd473d947a5dc988b6b75e30dbf0cca5b666a014e9a002d9bcb9f93"},"schema_version":"tcw.workbench-projection/v0.5","session_id":"e134ab4b7be33a82ad139a9745f0c63cff3dd6ab30c914938fab9ecba38c797c"}
